{
 "version": "1.0",
 "target_focus": "cad",
 "focus_camera_anchor": "Anchor_Heart",
 "show_territories": false,
 "meshes": {
  "Coronary_LAD": {
   "color": "#EED7BB",
   "opacity": 1.0,
   "flagged": false,
   "emissive": 0.0,
   "pulse_hz": 0.0,
   "outline_color": null,
   "badge": null,
   "target": "lad",
   "visible": true,
   "tooltip": "Left Anterior Descending (LAD) - Supplies blood to the front of the heart. Model-estimated probability of >=50% stenosis: 7% (decision threshold 46%). Model reliability: Moderate (hold-out AUC 0.83). Whole-vessel estimate: the dataset has no lesion location."
  },
  "Territory_LAD": {
   "color": "#EED7BB",
   "emissive": 0.0,
   "pulse_hz": 0.0,
   "flagged": false,
   "target": "lad",
   "outline_color": null,
   "badge": null,
   "visible": false,
   "opacity": 0.0,
   "tooltip": "Typical perfusion territory (right-dominant anatomy assumed); individual anatomy varies. Colour is derived from the vessel prediction, never from Region RWMA."
  },
  "Coronary_LCX": {
   "color": "#F1CB9C",
   "opacity": 1.0,
   "flagged": false,
   "emissive": 0.0,
   "pulse_hz": 0.0,
   "outline_color": null,
   "badge": null,
   "target": "lcx",
   "visible": true,
   "tooltip": "Left Circumflex (LCX) - Supplies blood to the side and back of the heart. Model-estimated probability of >=50% stenosis: 14% (decision threshold 29%). Model reliability: Moderate (hold-out AUC 0.77). Whole-vessel estimate: the dataset has no lesion location."
  },
  "Territory_LCX": {
   "color": "#F1CB9C",
   "emissive": 0.0,
   "pulse_hz": 0.0,
   "flagged": false,
   "target": "lcx",
   "outline_color": null,
   "badge": null,
   "visible": false,
   "opacity": 0.0,
   "tooltip": "Typical perfusion territory (right-dominant anatomy assumed); individual anatomy varies. Colour is derived from the vessel prediction, never from Region RWMA."
  },
  "Coronary_RCA": {
   "color": "#EFD3B1",
   "opacity": 1.0,
   "flagged": false,
   "emissive": 0.0,
   "pulse_hz": 0.0,
   "outline_color": null,
   "badge": null,
   "target": "rca",
   "visible": true,
   "tooltip": "Right Coronary Artery (RCA) - Supplies blood to the right side and bottom of the heart. Model-estimated probability of >=50% stenosis: 9% (decision threshold 27%). Model reliability: Limited (hold-out AUC 0.74). Whole-vessel estimate: the dataset has no lesion location."
  },
  "Territory_RCA": {
   "color": "#EFD3B1",
   "emissive": 0.0,
   "pulse_hz": 0.0,
   "flagged": false,
   "target": "rca",
   "outline_color": null,
   "badge": null,
   "visible": false,
   "opacity": 0.0,
   "tooltip": "Typical perfusion territory (right-dominant anatomy assumed); individual anatomy varies. Colour is derived from the vessel prediction, never from Region RWMA."
  },
  "Coronary_LM": {
   "color": "#C9C2B8",
   "opacity": 1.0,
   "emissive": 0.0,
   "pulse_hz": 0.0,
   "flagged": false,
   "target": null,
   "outline_color": null,
   "badge": null,
   "visible": true,
   "tooltip": "Left main: not modelled - no label in dataset."
  },
  "Coronary_Branches": {
   "color": "#C9C2B8",
   "opacity": 1.0,
   "emissive": 0.0,
   "pulse_hz": 0.0,
   "flagged": false,
   "target": null,
   "outline_color": null,
   "badge": null,
   "visible": true,
   "tooltip": "Diagonal and other branches: not modelled - no label in dataset."
  },
  "Aorta": {
   "color": "#D9CFC4",
   "opacity": 1.0,
   "emissive": 0.0,
   "pulse_hz": 0.0,
   "flagged": false,
   "target": null,
   "outline_color": null,
   "badge": null,
   "visible": true,
   "tooltip": "Aorta (anatomical context)."
  },
  "Torso_Shell": {
   "color": "#F1ECE6",
   "opacity": 0.18,
   "emissive": 0.0,
   "pulse_hz": 0.0,
   "flagged": false,
   "target": null,
   "outline_color": null,
   "badge": null,
   "visible": true,
   "tooltip": "Torso (anatomical context)."
  },
  "Heart_Myocardium": {
   "color": "#E9D0C3",
   "opacity": 1.0,
   "emissive": 0.15,
   "pulse_hz": 0.5,
   "flagged": true,
   "target": "cad",
   "outline_color": null,
   "badge": null,
   "visible": true,
   "tooltip": "Overall CAD risk tier: Moderate (model-estimated CAD probability 58%). Expected number of stenotic vessels: 0.3 of 3 (shown as a number only, not drawn on the heart)."
  }
 },
 "vessels": {
  "lad": {
   "prob": 0.07,
   "threshold": 0.465,
   "flagged": false,
   "label": "Normal",
   "color": "#EED7BB",
   "badge": null,
   "reliability": "Moderate",
   "holdout_auc": 0.832,
   "top_drivers": [
    {
     "label": "Typical chest pain",
     "value": 0,
     "unit": "",
     "contribution_pct": 18.77,
     "direction": "lowers risk"
    },
    {
     "label": "Age",
     "value": 50.0,
     "unit": "years",
     "contribution_pct": 9.92,
     "direction": "lowers risk"
    },
    {
     "label": "Regional wall-motion abnormality",
     "value": 0,
     "unit": "regions",
     "contribution_pct": 8.06,
     "direction": "lowers risk"
    }
   ],
   "tooltip": "Left Anterior Descending (LAD) - Supplies blood to the front of the heart. Model-estimated probability of >=50% stenosis: 7% (decision threshold 46%). Model reliability: Moderate (hold-out AUC 0.83). Whole-vessel estimate: the dataset has no lesion location.",
   "display_name": "Left Anterior Descending (LAD)",
   "camera_anchor": "Anchor_LAD",
   "mesh_names": [
    "Coronary_LAD"
   ]
  },
  "lcx": {
   "prob": 0.145,
   "threshold": 0.29,
   "flagged": false,
   "label": "Normal",
   "color": "#F1CB9C",
   "badge": null,
   "reliability": "Moderate",
   "holdout_auc": 0.768,
   "top_drivers": [
    {
     "label": "Age",
     "value": 50.0,
     "unit": "years",
     "contribution_pct": 28.21,
     "direction": "lowers risk"
    },
    {
     "label": "Creatinine",
     "value": 1.0,
     "unit": "mg/dL",
     "contribution_pct": 8.46,
     "direction": "lowers risk"
    },
    {
     "label": "Sex (male)",
     "value": "Fmale",
     "unit": "",
     "contribution_pct": 7.72,
     "direction": "lowers risk"
    }
   ],
   "tooltip": "Left Circumflex (LCX) - Supplies blood to the side and back of the heart. Model-estimated probability of >=50% stenosis: 14% (decision threshold 29%). Model reliability: Moderate (hold-out AUC 0.77). Whole-vessel estimate: the dataset has no lesion location.",
   "display_name": "Left Circumflex (LCX)",
   "camera_anchor": "Anchor_LCX",
   "mesh_names": [
    "Coronary_LCX"
   ]
  },
  "rca": {
   "prob": 0.093,
   "threshold": 0.275,
   "flagged": false,
   "label": "Normal",
   "color": "#EFD3B1",
   "badge": null,
   "reliability": "Limited",
   "holdout_auc": 0.741,
   "top_drivers": [
    {
     "label": "Age",
     "value": 50.0,
     "unit": "years",
     "contribution_pct": 18.33,
     "direction": "lowers risk"
    },
    {
     "label": "Diabetes mellitus",
     "value": 0,
     "unit": "",
     "contribution_pct": 11.03,
     "direction": "lowers risk"
    },
    {
     "label": "Neutrophils",
     "value": 39.0,
     "unit": "%",
     "contribution_pct": 10.45,
     "direction": "lowers risk"
    }
   ],
   "tooltip": "Right Coronary Artery (RCA) - Supplies blood to the right side and bottom of the heart. Model-estimated probability of >=50% stenosis: 9% (decision threshold 27%). Model reliability: Limited (hold-out AUC 0.74). Whole-vessel estimate: the dataset has no lesion location.",
   "display_name": "Right Coronary Artery (RCA)",
   "camera_anchor": "Anchor_RCA",
   "mesh_names": [
    "Coronary_RCA"
   ]
  }
 },
 "heart": {
  "cad_prob": 0.577,
  "threshold": 0.195,
  "label": "CAD",
  "risk_tier": "Moderate",
  "expected_stenotic_vessels": 0.309,
  "reliability": "High",
  "holdout_auc": 0.895,
  "tooltip": "Overall CAD risk tier: Moderate (model-estimated CAD probability 58%). Expected number of stenotic vessels: 0.3 of 3 (shown as a number only, not drawn on the heart).",
  "camera_anchor": "Anchor_Heart"
 },
 "regions": [
  {
   "region": "heart",
   "display_name": "Heart",
   "mesh_names": [
    "Heart_Myocardium"
   ],
   "camera_anchor": "Anchor_Heart",
   "intensity": 1.0,
   "net_shap": -0.415,
   "direction": "lowers",
   "color": "#3B7DD8",
   "icon": "arrow_down",
   "features": [
    "Typical chest pain",
    "EF-TTE (ejection fraction)",
    "Non-anginal chest pain",
    "T-wave inversion",
    "ST depression",
    "Q wave",
    "ST elevation",
    "Regional wall-motion abnormality",
    "Left ventricular hypertrophy",
    "Poor R-wave progression",
    "Bundle branch block",
    "Atypical chest pain",
    "Pulse rate",
    "Functional class",
    "Systolic murmur",
    "Diastolic murmur",
    "Valvular heart disease",
    "Congestive heart failure",
    "Low-threshold angina",
    "Exertional chest pain"
   ],
   "tooltip": "Heart: location of a contributing risk factor - NOT the location of disease. Net effect on CAD (Cath) risk: lowers risk (Typical chest pain, EF-TTE (ejection fraction), Non-anginal chest pain, T-wave inversion, ST depression, Q wave, ST elevation, Regional wall-motion abnormality, Left ventricular hypertrophy, Poor R-wave progression, Bundle branch block, Atypical chest pain, Pulse rate, Functional class, Systolic murmur, Diastolic murmur, Valvular heart disease, Congestive heart failure, Low-threshold angina, Exertional chest pain)."
  },
  {
   "region": "whole_body",
   "display_name": "Whole body",
   "mesh_names": [
    "Torso_Shell"
   ],
   "camera_anchor": "Anchor_WholeBody",
   "intensity": 0.905,
   "net_shap": -0.376,
   "direction": "lowers",
   "color": "#3B7DD8",
   "icon": "arrow_down",
   "features": [
    "Age",
    "Sex (male)",
    "BMI",
    "Obesity",
    "Weight",
    "Height"
   ],
   "tooltip": "Whole body: location of a contributing risk factor - NOT the location of disease. Net effect on CAD (Cath) risk: lowers risk (Age, Sex (male), BMI, Obesity, Weight, Height)."
  },
  {
   "region": "vessels",
   "display_name": "Blood vessels & lipids",
   "mesh_names": [
    "Aorta"
   ],
   "camera_anchor": "Anchor_Vessels",
   "intensity": 0.618,